{"schema_version": "0.5", "asset": {"path": "asset.svg", "sha256": "ac95c257b70055f7c09c48b7abc0f46244e1a4909a2b5a4c34c82d04101ec6c4"}, "constraints": {"max_svg_gradients": 1, "max_svg_stroke_width": 2}, "features": [{"id": "diag", "role": "foreground", "properties": {"svg_path_id": "diag", "min_path_length": 5, "max_path_length": 5, "min_path_segments": 1, "max_path_aspect_ratio": 1}}]}